{
  "schema_version": 1,
  "id": "source:omega-552-technical-guide-20261009",
  "kind": "source",
  "url": "https://myretrowatches.co.uk/wp-content/uploads/2025/06/Omega-552-NewLR.pdf",
  "publisher": "OMEGA SA (technical guide; mirrored by My Retro Watches)",
  "trust_tier": "primary",
  "reuse_class": "cite_only",
  "licence": "copyright, cite-only",
  "content_type": "image_scan",
  "archive_url": "https://web.archive.org/web/20261009005453id_/https://myretrowatches.co.uk/wp-content/uploads/2025/06/Omega-552-NewLR.pdf",
  "snapshot_sha256": "0ad4b0d2af37e46a811770ef221ac5df87b203bdd27d43f8244802718d2e3e5d",
  "retrieved_at": "2026-10-09",
  "notes": "TG-19-C-126-FDES, version A, 05.07.2013. All nine pages have no PDF text layer. Page 1 visually transcribed; requires human attestation. Full scan stays outside git."
}
