{
  "schema_version": 1,
  "id": "source:sellita-sw300-pdf-20260904",
  "kind": "source",
  "url": "https://sellita.ch/scripts/calibres/images/DocTec_SW300-1.pdf",
  "publisher": "Sellita Watch Co S.A.",
  "trust_tier": "primary",
  "reuse_class": "cite_only",
  "licence": "copyright, cite-only",
  "content_type": "pdf_text",
  "archive_url": "https://web.archive.org/web/20260904001124id_/https://www.sellita.ch/scripts/calibres/images/DocTec_SW300-1.pdf",
  "snapshot_sha256": "f9508543306d1a785f64683726a3c90a45fce94949a1efee467fd8d06b5612ff",
  "retrieved_at": "2026-10-08",
  "notes": "Maker digital sheet revision08,20.11.2024. Minimum50/typical56 running time not flattened into scalar reserve. Exact pypdf matching uses E1 support."
}
