{
  "schema_version": 1,
  "id": "source:sellita-sw200-pdf-20251006",
  "kind": "source",
  "url": "https://sellita.ch/scripts/calibres/images/DocTec_SW200-1_7.pdf",
  "publisher": "Sellita Watch Co S.A.",
  "trust_tier": "primary",
  "reuse_class": "cite_only",
  "licence": "copyright, cite-only",
  "content_type": "pdf_text",
  "archive_url": "https://web.archive.org/web/20251006110647id_/https://sellita.ch/scripts/calibres/images/DocTec_SW200-1_7.pdf",
  "snapshot_sha256": "511ad6793e8d6969c19c8fb8e459d6623de0aac505d7976a1a6cd0eae894c593",
  "retrieved_at": "2026-10-08",
  "notes": "Maker digital technical sheet revision 07, 02.09.2024. Exact pypdf text matching depends on E1; minimum/typical running time remains quoted but not collapsed into scalar reserve."
}
